sent,hard_match
 人物二 毋亲 人物一 原来 汉景帝 程姬 侍女,NaN
 定王 汉景帝 第十 子 人物二 人物一 生 微无宠 故封 王于 卑湿 贫国 长沙 卒 谥定,NaN
 汉景帝 刘启姬 妾 长 沙王 人物二 生母 人物一 本为 景帝 妃嫔 程姬 侍女,NaN
 定 王台 湖南省 长沙市 东 相传 汉景帝 之子定 王 人物二 为望 其母 人物一 墓而建 名,NaN
 起名叫 人物二 事后 发觉 错幸 人物一 意思,NaN
 意义 后人 感叹 说 没有 纯属偶然 人物一 误会 不会 人物二 更 不会 刘秀 不会 东汉,NaN
 前 三个 孩子 出自 栗姬 四子 刘 馀 五 子 刘非 六子 刘端 出自 程姬 七子 刘彭祖 八子 刘胜 出自 贾夫人 九 子 人物二 出自 人物一 程姬 侍者,NaN
 五宗 世家 人物一 子 人物二,NaN
 五宗 人物一 子 人物二,NaN
 作品 注释 ① 定 王台 湖南长沙市 东 相传 汉景帝 之子定 王 人物二 瞻望 其母 人物一 墓而建,NaN
 水调歌头 雄 跨 洞庭 野 作品 注释 ① 定 王台 湖南长沙市 东 相传 汉景帝 之子定 王 人物二 瞻望 其母 人物一 墓而建,NaN
 人物一 子 人物二,NaN
 汉书 长沙 定王 人物二 传 生子 名曰 发 颜师古 注引 三国 魏 张晏 曰 长沙 王生 乃发 寤 缪幸 人物一,NaN
 皇六子 长沙 定王 人物二 五世 孙为 东 汉光武帝 刘秀 母 人物一,NaN
 水调歌头 定 王台 作品 注释 ① 定 王台 湖南长沙市 东 相传 汉景帝 之子定 王 人物二 瞻望 其母 人物一 墓而建,NaN
 人物一 逃至 蒙古 诞下子 人物二 惜弱 诞子 杨康,NaN
 宁国公 人物一 孙子 京营 节度使 世袭 一等 神威 将军 人物二 次子,NaN
 ▪ 人物一 ▪ 贾源 ▪ 人物二 ▪ 贾代善 ▪ 贾代儒 ▪ 贾代修 ▪ 贾敷 ▪ 贾敬,NaN
