sent,hard_match
 胜 公输 仇 驾驶 机关 蛇 人物二 人物一 共同 驾驶 机关 白虎,NaN
 胜 两名 蜃楼 太阳 武士 人物二 人物一 吸引 敌人 注意力,NaN
 第十三 集 人物二 人物一 石兰 对战 无果 发出 招式 石兰 巫山 朝云 抵消,NaN
 人物二 人物一 化名 为子明 子羽 进入 儒家,NaN
 偶然 听见 子羽 人物一 化名 儒家 弟子 讨论 通缉犯 对子 羽 子明 人物二 化名 身份 产生 怀疑,NaN
 人物二 人物一 石兰 对战 无果 双方 均 受 一定 程度 伤 最后 三人 逃走 司命 动画电影 剧情 时间 线 进行 排序,NaN
 败于 云霄阁 药人众 人物二 人物一 合力 天明 少羽 帮助 逃出 石兰 少羽败 虞子期,NaN
 察觉到 人物二 人物一 石兰 小虞 已经 登上 蜃楼,NaN
 人物二 人物一 小虞 化名 石兰 三人 闯入 蜃楼,NaN
 角色 经历 人物二 人物一 化名 子明 子羽 进入 儒家,NaN
 羽明 人物一 人物二,NaN
 冯骏骅 人物二 燕 太子妃 沈达威 人物一,NaN
 原本 长 蜀山 竟 人物二 人物一 石兰 发现 秦始皇 派 阴阳家 公输 家族 建造 巨型 楼船 蜃楼,NaN
 人物二 人物一 帮助 是否 归还 龙魂 解救 楼兰,NaN
 人物二 人物一 对战 无果 二人 逃走,NaN
 人物二 人物一 化名 子明 子羽 进入 儒家,NaN
 人物一 全 不在意 一双 眼睛 仔细 端详 人物二 怀里 灰 道 那有 反正 迟早 败 手下,NaN
 人物一 奇怪 人物二 一眼 道 知道,NaN
 人物二 道 刚才 结识 一位 风回峰 师兄 听 说 名叫 人物一,NaN
 人物一 青云 门风 回峰 首座 曾叔常 独子 七脉会 武中 人物二 三眼 灵猴 相识 结为 好友,NaN
 师侄 齐昊 宋大仁 文敏 楚誉宏 人物一 林惊羽 田灵儿 陆雪琪 人物二,NaN
 青云 门下 二代 弟子 人物二 陆雪琪 人物一 一同 前往 空桑 山 查探 魔教 踪迹 田灵儿 结为夫妇,NaN
 人物一 哑然 人物二 却是 忍不住 道 那就是说 法相 师兄 没有 把握 说不定 家伙 进洞 扑 过来 如何是好,NaN
 人物二 勉强 笑 一下 见 人物一 脸色 严峻 过来 眼光 竟 似 冰冷,NaN
 言 毕 深吸 一口气 忽然 身形 一飘 不发 一言 飘然 远去 人物二 人物一 注意 时 片刻 金瓶儿 已然 远,NaN
 人物二 七脉会 武时 凭着 运气 噬魂 大放异彩 期间 结交 风 回峰 弟子 人物一 对阵 竹峰 冷若冰霜 女弟子 陆雪琪,NaN
 人物一 羡慕 灰 随即 回头 人物二 道 张师弟 通天 峰 参加 七脉 会武,NaN
 人物一 面露 无奈 之色 瞪 人物二 一脸 悻悻然 表情 身边 一句 没 一句 瞎扯,NaN
 人物二 陆雪琪 人物一 齐昊 派 空桑 山 历练 小凡 客栈 山海 苑 遇见 绿衣 少女 碧瑶,NaN
 人物二 一巴掌 拍掉 人物一 手臂 脸上 笑意 温和 依然 摇头 道 没 看过,NaN
 四强 齐昊 人物一 陆雪琪 人物二,NaN
 二人 向前 走 几步 人物一 忙 端详 怀里 灰 人物二 似 满腹 心思 沉默不语,NaN
 师弟 人物二 人物一,NaN
 魔教 余孽 夜探 河阳 古墓 寻找 云殿 夜晚 人物二 青云山 救出 金瓶儿 逼入 苦战 人物一,NaN
 人物一 前来 阻止 人物二 誓死 杀 碧瑶 报父仇 鬼厉 誓死 守护 碧瑶,NaN
 人物一 停 脚步 现 身边 空无一人 回头一看 见 人物二 不知 停 下来 站 身后 怔怔 看着 脸色 大是 古怪,NaN
 诛仙 世界 妹妹 小诗 之间 亲情 人物二 人物一 之间 友情 束缚 雨泽,NaN
 人物一 人物二 一眼 淡淡 道 倒 没 看出 深藏不露 亏得 还求 彭 师兄 手下留情 没想到 害,NaN
 人物一 站 一旁 分明 看到 人物二 眼光 脸色 迅 黯淡 下去 几乎 没有 丝毫 生气 不由得 皱起 眉头,NaN
 风回峰 弟子 显然 人物一 极好 一个个 旁边 让开 连带 人物二 沾光 挤 进去,NaN
 遇到 金瓶儿 林惊羽 人物一 萧逸才 一同 寻宝 而来 黑水 玄蛇 黑水 玄蛇 人物二 陆雪琪 撞 天地 宝库 石门,NaN
 人物二 人物一 肩上 手 用力 抓 一下 转向 杨 焰心 走到 面前 想 想 语气 深长 道 天下,NaN
 师侄 齐昊 宋大仁 文敏 楚誉宏 人物一 田灵儿 林惊羽 陆雪琪 人物二 青云 门 十九代 弟子,NaN
 人物一 目瞪口呆 表情 中 人物二 厨房 角落 一个 罐子 背后 灰 拎 起来,NaN
 爱慕 人物二 鬼厉 李洵 人物一,NaN
 人物二 人物一 陆雪琪 齐昊 派 空桑 山 历练 小凡 客栈 山海 苑 邂逅 碧瑶 两人 刻骨铭心 爱恋,NaN
 师侄 萧逸才 齐昊 宋大仁 文敏 人物一 田灵儿 林惊羽 陆雪琪 人物二,NaN
 人物一 不理 拉上 人物二 往里 挤,NaN
 人物一 走 过去 一把 搂住 人物二 肩膀 笑 道 别扯 两人 快 说实话 那书 肯定 看过,NaN
 青云 门下 弟子 人物二 陆雪琪 人物一 一同 前往 空桑 山 查探 魔教 踪迹 田灵儿 结为夫妇,NaN
 人物二 登时 噤若寒蝉 人物一 倒吸 一口 凉气 二人 不敢 装出 一副 认真听讲 架势 听 苍松道人 台上 训话,NaN
 秦川 人物一 女扮男装 时 化名 徐陵 正好 人物二 减缩 版本,NaN
 李世民 多情 公子 侯希白 人物二 均 锺 情 於 人物一,NaN
 寇仲 人物二 李世民 石青璇 尚秀芳 人物一 绾 绾,NaN
 人物二 人物一 拈花微笑 相逢 一刻,NaN
 争夺 邪帝 舍利 人物二 人物一 帮助 之下 石之轩 施展 绝技 玉石俱焚 爆体 而亡,NaN
 人物一 不食 人间烟火 人物二 那段 精神 爱恋 如梦似 幻 铭心刻骨,NaN
 婠婠 人物二 一番 情意 直来直去 敢爱敢恨 率真 曾令 支持率 一向 高 居于 人物一 之上,NaN
 背景 大唐 双龙传 寇仲 人物二 绾 绾 人物一 宁道奇 酱油,NaN
 人物二 方面 邂逅 慈航静 斋 圣女 人物一 超尘 脱俗 气质 吸引 因暄 身负 圣女 身份 不能 涉及 儿女 私情 两人 有缘无份,NaN
 人物二 百般 解释 人物一 只信 文媚儿,NaN
 白云飞 非常高兴 两个 人为 稳当 计 先 没 事情 告诉 人物二 人物一,NaN
 人物一 第八集 人物二 命悬 发丝 陈林 救下,NaN
 人物一 人物二 市集 交锋,NaN
 人物一 第十八 集 静修 杀 朱允 不想 朱允 人物二 带走 逃跑,NaN
 后来 云南 王 儿子 人物一 结为 连理 人物二 成为 皇后 之间 成为 姑嫂 关系 两 更 象是 一对 姐妹,NaN
 文媚儿 挑拨 人物一 安宁 恨透了 人物二,NaN
 最后 人物二 成为 皇后 人物一 白云飞 喜结连理,NaN
 人物一 上当 恳求 朱允 人物二 进宫 陪伴 朱允 似乎 十分 无奈 答应 心里 十分高兴,NaN
 千钧一发 之际 人物二 白云飞 人物一 带 云南 兵 攻击 齐国 公和 蓟州 侯,NaN
 人物一 第二集 人物二 骗过 衙役 逃走 朱允 白云飞 误认为 强盗,NaN
 人物二 生 龙凤胎 人物一 怀上 孩子,NaN
 人物一 第十六集 人物二 见到 朱允 晓以大义 朱允 如梦方醒,NaN
 人物一 第五集 人物二 怀疑 朱允 身份 反 朱允 说 秘密,NaN
 人物一 回京 路见不平 人物二 大打出手,NaN
 白云飞 人物一 相信 人物二 会干 出害 皇子 流产 事,NaN
 人物一 惩罚 人物二 心态 安宁 公 灌输 计谋,NaN
 白云飞 变得 快乐 异常 人物二 人物一 觉得 奇怪,NaN
 司徒剑南 第九集 人物二 气 人物一 一顿 放回,NaN
 人物一 朱允 人物二 白云飞 双双 离去 心痛 文媚儿 趁机 火上浇油,NaN
 人物一 白云飞 一起 人物二 朱允 假作 赛马 离开,NaN
 人物一 第十一 集 文蔷 救 人物二,NaN
 司徒剑南 第二十七 集 人物二 回宫 继续 想 办法 搓合 白云飞 人物一 可惜 设计 计策,NaN
 白云飞 人物二 用情 逾 深 皇帝 宣招 慌 称病 不能 入宫 人物一 见面,NaN
 人物一 剧情简介 前朝 公主 人物二 大将军 司徒 青云 夫妇 收养 倍受 宠爱,NaN
 飞 写下 契约 为证 同意 解除 人物一 白云飞 婚事 不再 纳 人物二 妃 朋友,NaN
 白云飞 人物二 越 走 越近 朱允 感觉 不妙 宣 白云飞 入宫 奉旨 人物一 成亲,NaN
 人物一 发现 白云飞 心里 关心 人物二 醋意 大发,NaN
 人物一 第十九 集 文媚儿 蛊惑 太后 治 人物二 皇上 带入 险境 之罪,NaN
 朱允 保护 人物二 人物一 高兴,NaN
 人物二 欲 兄长 出口 恶气 人物一 手下人 绑架 入宫,NaN
 人物一 第二十八 集 文章 终于 找来 确凿证据 文媚儿 皇上 太后 揭出 人物二 前朝 公主 身份 朱允 万箭穿心,NaN
 人物一 第二十四集 朱允 亲自 出城 寻找 人物二 找到 那座 古刹,NaN
 白云飞 人物一 万人敌 报信 赶来 救下 朱允 人物二 静修 顾一洲 只好 撤退,NaN
 人物二 人物一 看清 文媚儿 设计 文媚儿 单独 见面,NaN
 人物一 第三集 白云飞 知朱允 人物二 简单 人物 已起 结交 之心,NaN
 司徒剑南 第十三 集 文媚儿 挑拨 人物一 安宁 恨透了 人物二,NaN
 人物二 人物一 竟 渐渐 打出 交情,NaN
 白云飞 人物一 没有 进展 发现 朱允 人物二 迟迟 不归 不由 全都 慌,NaN
 朱七七 多情 人物二 正直 人物一 豪爽 善良 或多或少 触及 不愿 触及 内心,NaN
 人物一 人物二 眼里 此人 身长 八尺 沉眉大眼 腰畔 斜插 柄 无鞘 短刀 手里 提着 发亮 酒 葫芦 一面 高歌 一面 痛饮,NaN
 风华 度 人物一 星 人物二 星,NaN
 人物二 白飞飞 前去 探望 朱七七 人物一 热情 挽留 沈 留下来 喝酒,NaN
 朱七七 进入 祠堂 人物一 强烈要求 人物二 带 重伤 白飞飞 一起 上路,NaN
 武林 外史 同人 朱七七 主要 角色 主角 朱七七 人物二 人物一,NaN
 对决 三 天下第一 神偷 人物二 人物一,NaN
 王怜花 巧言 狡辩 人物二 人物一 借此 将计就计,NaN
 人物一 反应 人物二 交个 朋友 找 晦气,NaN
 出 洞后 会 山下 凉亭 听到 人物二 白飞飞 幽灵 宫主 对话 交谈 得知 人物一,NaN
 朋友 人物二 人物一 朱七七,NaN
 快活 王 义子 人物一 追踪 误上 花轿 朱七七 时 人物二 云梦 轩 相遇 结交 成 朋友,NaN
 人物二 二遇 人物一 成 终生 朋友 传 千古佳话 友情 之道 难道 真的 简单,NaN
 人物二 王怜花 独孤 伤及 人物一 被困 花 神祠,NaN
 人物二 人物一 看着 奄奄一息 朱七七 无力回天 猫儿 求助于 快活 王,NaN
 其实 人物二 曾经 说 天生 做 大哥 龙 四海 人物一 更是如此,NaN
 三人 一同 藏匿 人物一 朱七七 花 神祠 洞窟 欲 救人 花 神祠 看到 白飞飞 神情 相像 花 神像 人物二 似 有所 悟,NaN
 而怜花 得知 七七 亲生 妹妹 羞愤 交加 之下 竟动 杀机 人物二 人物一 联手 搏杀,NaN
 后世 化成 传说 人物二 王怜花 泯 恩仇 偕同 朱七七 人物一 共赴 海外 仙山,NaN
 人物一 找寻 七七 时 碰见 正在 调查 鬼庄 闹鬼 人物二,NaN
 人物二 王怜花 独孤 伤及 人物一 被困 花 神祠,NaN
 人物二 人物一 惺惺相惜 王怜花 之间 发展 友情 敌人 关系,NaN
 武林 一书 男角 人物二 仙气 人物一 豪气 王怜花 有鬼 气 金无望 妖气,NaN
 幸好 游侠 人物一 王怜花 帮助 恢复 容貌 人物二 金无望 相聚,NaN
 朱七七 人物一 只觉 腰 畔 似 麻 麻 竟 身不由主 坐 下去 竟 再也不能 站 眼睛 瞪 人物二,NaN
 王怜花 人物一 疲于 本命 人物二 守候 一起 朱七七 最大 幸福,NaN
 回到 欧阳喜 家后 依次 人物二 欧阳喜 人物一 对话 认为 两名 丑女 可能 人易 过容,NaN
 人物一 人物二 放下 党羽 说走就走,NaN
 人物二 救 人物一 三人 一起 前去 营救 扮作 色使 王怜花 掳 朱七七,NaN
 白飞飞 极为 自责 想要 进 火场 人物二 陪葬 金无望 人物一 拦住,NaN
 朋友 李寻 欢 阿飞 人物二 人物一 陆小凤 西门吹雪 俞佩玉 傅红雪 小鱼儿 楚留香,NaN
 幸得 人物一 帮助 人物二 巧妙 化解 危机,NaN
 人物一 借醉 盗走 金无望 身上 财物 人物二 不知不觉 盗回 连带 盗走 猫儿 身上 之物,NaN
 人物二 精彩 片段 人物一 嗄 声道 哪条 路 走,NaN
 朱七七 人物二 王怜花 人物一 四人同 赴 海外 仙山 隐居,NaN
 最佳 福星 主演 洪金宝 人物一 谭咏麟 郑则士 人物二,NaN
 影片 评价 这部 片 群星 真的 没话说 五位 福星 洪金宝 人物一 人物二 吴耀汉 秦祥林,NaN
 主演 黄子华 人物二 毛舜筠 黄宗泽 何韵诗 人物一 邵音音 农夫 马赛 乔宝宝,NaN
 基本 信息 八宝 奇兵 霍耀良 执导 香港 剧情片 人物二 人物一 惠英红 领衔主演,NaN
 陈百祥 人物二 杜汶泽 余文乐 黄浩然 韩君婷 莫少聪 人物一 麦家琪,NaN
 张曼玉 王晶 人物二 人物一 吴君如 李美凤,NaN
 五 福星 组合 洪金宝 执导 喜剧 动作 犯罪 片 洪金宝 人物二 吴耀汉 秦祥林 苗侨伟 人物一 主演,NaN
 精装 追女仔 周润发 张曼玉 人物二 陈百祥 人物一,NaN
 主演 人物二 谭咏麟 陈百祥 叶玉卿 人物一 黄宗泽,NaN
 主演 洪金宝 人物二 吴耀汉 人物一 苗侨伟 曹达华 陈观泰 陈百祥,NaN
 电影 主要 介绍 王晶 电台 人物二 人物一 林俊贤 四人 之间 故事,NaN
 吴耀汉 人物二 人物一 苗侨伟 参加 演出,NaN
 演员 人物二 毛舜筠 黄宗泽 何韵诗 人物一 邵音音 农夫 群星,NaN
 主演 谭咏麟 陈百祥 叶玉卿 人物二 人物一 黄宗泽 谢天华 徐子珊 郑欣宜,NaN
 主演 吴耀汉 人物二 人物一 苗侨伟 刘嘉玲,NaN
 人物二 暗爽 之时 却说 此人 人物一,NaN
 众人 救 薛冰 慕容 双 檀香 剑客 杀出 老实 和尚 人物一 人物二 受了伤 回到 花家,NaN
 人物二 人物一 公孙兰 三人 登上 神秘岛 发现 岛上 武功 奇高,NaN
 青 蓝两色 童子 人物二 朋友 西门吹雪 人物一,NaN
 当晚 江湖 朋友 人物一 帮 人物二 找到 只能 坐 棺材 进出 地方 极乐 楼,NaN
 人物二 啸傲 武林 头痛 事 见 人物一 头 大如斗,NaN
 人物一 设计 人物二 引 栖霞 宫 遇到 江轻霞 发现 穿着 红鞋子,NaN
 这是 人物二 骂 人物一 编 词,NaN
 毒针 阴谋 幕后 黑手 两人 好友 人物二 西门吹雪 人物一 危险 重重的 查案,NaN
 案发后 人物一 偷取 牡丹 红帕 人物二 怀疑 金九 龄,NaN
 西门吹雪 讲究 杀人 沐浴 斋戒 人物一 随意 人物二 翻跟头 挖 蚯蚓,NaN
 第一次 人物一 输给 人物二,NaN
 人物二 绣花 大盗 饰 人物一,NaN
 一个 收获 人物二 偶遇 人物一,NaN
 从今天起 人物二 没有 人物一 朋友,NaN
 查明真相 人物二 故伎重演 放走 江青 霞 人物一 不请自到 薛冰 黑衣 蒙面,NaN
 人物二 人物一 遇到 怪 脾气 岳洋,NaN
 古龙 人物一 人物二 见面 总要 吵 几句,NaN
 人物一 一个 时辰 内连翻 六百 八十个 跟头 人物二 十天 挖 六 百八十 条 蚯蚓 武侠 史上 有趣 赌局,NaN
 二百四十 八章 人物二 人物一,NaN
 人物二 决定 人物一 调查 神秘岛 码头 遇到 牛肉汤,NaN
 人物一 送来 神秘 纸条 人物二 花满楼 卷入 一场 离奇 江湖 血案,NaN
 这是 人物一 骂 人物二 编 词,NaN
 花满楼 人物二 西门吹雪 人物一,NaN
 人物一 偷 王之王 人物二 好友,NaN
 人物二 一句 话 真相 人物一 根本 蚯蚓,NaN
 人物二 约 赌 人物一 王府 偷 珍宝,NaN
 同班同学 黑崎一护 朽木 露琪亚 石 田雨 龙 茶渡 泰虎 人物二 浅野启 吾 小岛 水色 人物一,NaN
 黑崎一护 朽木 露琪亚 人物二 石 田雨 龙 茶渡 泰虎 人物一 浅野启 吾 小岛 水色,NaN
 人物一 人物二 房间 一同 攻击 后来 昏倒,NaN
 一护 班级 寻找 可爱 女 学生 混乱 亲 人物二 手背 人物一 脸颊 龙贵 发飙 打人,NaN
 姬无夜 被雀阁 之事 惹怒 命令 人物一 杀死 人物二,NaN
 输掉 比赛 人物二 人物一 带去 姬无夜 关在雀阁 里 新 猎物 韩国 琴姬 弄玉,NaN
 最终 人物一 牺牲 保护 人物二 弄玉 姬无夜 手下 逃走 弄玉 不久 之后 毒发 身亡,NaN
 人物二 人物一 结局,NaN
 人物一 指挥 乌鸦 拼死 保护 三人 姬无夜 利箭 射穿 要害 回身 抓住 箭 保护 人物二,NaN
 最终 人物一 保护 人物二 弄玉 姬无夜 手下 逃走 死,NaN
 人物一 最终 救 人物二 牺牲,NaN
 人物一 救 人物二 得罪 姬无夜 死 死前 一度 重创 姬无夜,NaN
 人物一 控制 群鸦 形成 保护层 护住 三人 姬无夜 利箭 射穿 右胸 箭 离身 一刻 回身 抓住 箭身 身后 人物二 免受 伤害,NaN
 人物一 最终 救 人物二 牺牲,NaN
 人物二 成功 带 弄玉 逃离 大将军 府 人物一 重伤 之躯 重创 气急败坏 姬无夜 之后 平静 走向 死亡,NaN
 奉命 追杀 人物二 信任 朋友 信赖 上级 夜幕 高手 人物一,NaN
 设计者 诠释 人物一 人物二 张,NaN
 姬无夜 命令 人物一 杀死 人物二,NaN
 输掉 比赛 人物二 人物一 带去 姬无夜 新 猎物 雀阁 里 关着 一位 抚着 空琴 美丽 女子 韩国 琴姬 弄玉,NaN
 韩非 怀疑 人物一 人物二,NaN
 人物二 人物一 先后 出手 相救 三人 姬无夜 关在 布满 机关 牢笼 里,NaN
 人物一 人物二 背影,NaN
 人物二 人物一 先后 出手 相救 三 人均 姬无夜 关 布满 机关 牢笼 里,NaN
 人物二 从小 百鸟 首领 人物一 带入 夜幕,NaN
 设计者 诠释 人物一 人物二 张,NaN
 念白 百醇 人物一 魔音 帝国 南宫 天真 人物二 南宫 纪夏 弄玉,NaN
 人物一 临死前 祝愿 人物二 能够 自由 飞翔,NaN
 人物二 视 人物一 信任 朋友 信赖 上级 亦师亦友 如兄 如父,NaN
 一个男孩 测试 成为 夜幕 百鸟 成员 命名 人物二 人物一 部下,NaN
 一个男孩 测试 成为 夜幕 百鸟 成员 命名 人物二 人物一 部下,NaN
 人物一 见 人物二 舍身 为己 出手 相救,NaN
 活死人 墓 小说 描述 主人 人物二 人物一,NaN
 人物一 处 接取 任务 婚缘 之事 来到 活死人 墓 找 人物二,NaN
 剑法 传到 古墓 人物一 创 人物二 所得,NaN
 后来 人物二 移居 古墓 之后 先 参透 人物一 遗下 古墓 武功 更 潜心 苦思 创出 克制 诸般 武功 法子,NaN
 人物二 无法 如愿以偿 人物一 所建 古墓 让给 居住 古墓 不远处 盖 全真 观 出家 道士,NaN
 人物一 人物二 之墓里 隐情,NaN
 天涯 幽魔 共有 六式 一式 等于 人物一 人物二 一击,NaN
 玉女心经 武功 人物二 所创 心想 人物一 爱护 回护 保护,NaN
 人物二 容貌 极美 秀眉 入鬓 眼角 之间 隐隐 带 一层 杀气 人物一 一对 冤家 情侣,NaN
 玉女 剑法 加 说明 同样 是因为 人物二 想 胜过 人物一 不想 伤害 玉女 剑 法剑招 奇幻 变化莫测 不易 伤人,NaN
 金庸 世界 里 剑圣 内容简介 现代人 林峰 回到 古代 成为 古墓派 祖师 人物二 弟弟 林朝峰 跟随 人物一 学艺 笑傲 射雕 三部曲,NaN
 人物二 人物一,NaN
 古墓派 名称 人物二 心念 人物一 竭尽 心智 研究 出 克制 全真 派 武功 玉女心经,NaN
 人物二 只道 人物一 瞧 不起 怨愤,NaN
 人物一 人物二,NaN
 重阳 朝英 人物一 人物二 均 武学奇 原 一对 天造地设 佳偶,NaN
 章 人物一 人物二,NaN
 人物二 怨恨 人物一 竭尽 心智 研究 出 克制 全真 派 武功 玉女心经,NaN
 人物二 卒 人物一 知悉 古墓派 玉女心经 法,NaN
 防御 推荐 人物一 人物二 全真 子,NaN
 刺杀 行动 失败 人物二 死难 朋友 高渐离 人物一 逃匿,NaN
 淮南子 泰族 训 人物二 西 刺秦王 高渐离 人物一 击筑 歌于 易水 之上 闻者 莫不 瞋目 裂 眦 发植穿冠,NaN
 淮南子 泰族 训 人物二 西 刺秦王 高渐离 人物一 击筑 歌于 易水 之上 闻者 瞋目 裂 眦 发植穿冠,NaN
 陶靖节 咏 人物二 诗 渐离击 悲筑 人物一,NaN
 发植穿冠 来源 淮南子 泰族 训 人物二 西 刺秦王 高渐离 人物一 击筑 歌于 易水 之上 闻者 瞋目 裂 眦 发植穿冠,NaN
 晋 陶潜 咏 人物二 渐离击 悲筑 人物一 唱 高声,NaN
 主演 李多海 饰珠裕 邻 李东旭 饰 人物二 李准 基饰 人物一,NaN
 终于 理解 人物二 人物一 爱,NaN
 终于 理解 人物二 人物一 爱,NaN
 新娘 作战 剧情简介 人物二 倪妮 饰 人物一 杨颖 饰 从小 相识 闺蜜,NaN
 剧情简介 人物二 倪妮 饰 人物一 杨颖 饰 从小 相识 闺蜜,NaN
 婚礼 撞期 面对 人物一 发狠 招 个性 好强 人物二 拿出 一副 撕 撕 怕,NaN
 片刻 人物一 独自一人 进来 脸上 带 笑 站 屋子 中央 人物二 说话,NaN
 人物二 目光 柔和 看着 一起 夫妻 二人 长长 松 一口气 人物一 道 决定 快 做 准备,NaN
 少废话 人物二 冷冷地 瞟 人物一 一眼,NaN
 李岳瑞 春 冰室 野乘 载 人物一 人物二 写密 褶参 隆科多 宠遇 日隆,NaN
 补充 一个 典故 人物一 人物二 府 幕 声名 日重 后来 雍正 知道,NaN
 第十回 人物二 多事陷 困境 人物一 片语 解 谜团,NaN
 人物一 自幼 读书 科举 得意 当时 巡抚 人物二 慕名 聘请 邬 先生 入幕 承办 一件 棘手 案件,NaN
 欺世盗名 追缴 藩库 人物二 人物一 拆穿 西洋镜 菜市口 斩首 全是 影子 没有 事,NaN
 人物一 集 人物二 摘星 星儿 来到 薛 家庄 发现 薛 家庄 名不虚传 庄内 高手如云 庄外 薛 家村 人人 习武,NaN
 人物一 集 人物二 宋 西湖 二人 互生 情愫 嵩山 派 掌门 剑 叟 不期而至,NaN
 其间 人物二 人物一 南国 堕入 爱河,NaN
 图片 张 人物一 集 人物二 回到 玄冰 宫内 发现 宫主 自封 于玄 冰宫 创派 祖师爷 墓室 之内,NaN
 人物二 人物一 李建平 国家 军委 呵护 生命,NaN
 李建平 人物一 人物二 职务 需 选择 北京 安置 新家,NaN
 人物一 策划 举办 黄永玉 作品 回乡 展 朱永成 走进 凤凰山 水 作品展 人物二 大海 精品展 卢望明 先生 禅 画展,NaN
 人物二 大海 艺术 研究会 领导 名单 顾问 人物一 本周 志范 会长 觉上,NaN
 人物二 先生 人物一 长久 交往 合作 生活 事业 万分 融洽 默契 艺术 圈 称为 洞庭 知己,NaN
 人物一 本觉 人物二 张,NaN
 领导 名单 会长 人物一 本觉 人物二 先生 题写 研究会 名称,NaN
 人物一 本觉 人物二 家 做客 始 艰辛 无比 入世 之旅,NaN
 楚湘 画院 人物一 人物二 大海 艺术 研究会 张,NaN
 赵履虫 司坤 路人甲 吓哭 烛天 传说 吓尿过 树懒 抖成 筛子 徐婷 人物一 人物二,NaN
 人物二 认为 人物一 徐婷 唱歌 心里 矛盾,NaN
 称 人物一 漫画 爱 人物二 漫画 当作 炫耀 工具,NaN
 外号 徐婷 人物一 人物二 崇拜 徐婷 疯婆子 庶岚 金发 少女 波菲 科特,NaN
 树懒 教 画 漫画 人物一 人物二 化装 成萌萝莉 露露 小姐 终于 树懒 教 画 漫画,NaN
 烛天 离开 人物一 人物二 一起 机场 追烛 天,NaN
 外号 徐婷 人物一 人物二 崇拜 徐婷 金发 少女 波菲 科特,NaN
 树懒 教 画 漫画 人物一 人物二 化装 成 露露 小姐 终于 树懒 教 画 漫画,NaN
 人物一 人物二 作品 反复 临摹 两遍,NaN
 注定 千山 暮雪 主角 人物二 莫绍谦 萧山 人物一,NaN
 虐恋 千山 暮雪 主角 人物二 莫绍谦 萧山 人物一,NaN
 注定 千山 暮雪 主角 人物二 莫绍谦 萧山 人物一,NaN
 包括 莫绍谦 事业 追求 慕咏飞 关系 人物二 设计 提高 和悦 莹 友情 萧山 人物一 关系,NaN
 注定 千山 暮雪 主角 人物二 莫绍谦 萧山 人物一,NaN
 莫绍谦 发现 人物二 人物一 交情 安排 饭局 揭穿 众人 身份,NaN
 注定 千山 暮雪 主角 人物二 莫绍谦 萧山 人物一,NaN
 千 取 莫绍谦 谐音 山是 萧山 暮 人物一 雪 人物二,NaN
 友人 人物一 调查 人物二 得知 莫绍谦 宿怨 赫然 明白 莫绍谦 复杂 心情 缘由,NaN
 人物一 很多 歌手 名人 人物二 韦嘉 李湘 创作 歌曲 好评,NaN
 陪 成功 歌手 简介 人物一 很多 歌手 名人 人物二 韦嘉 李湘 创作 歌曲 好评,NaN
 同心 歌手 简介 人物一 很多 歌手 名人 人物二 韦嘉 李湘 创作 歌曲 好评,NaN
 歌手 简介 人物一 很多 歌手 名人 人物二 韦嘉 李湘 创作 歌曲 好评,NaN
 人物一 改邪归正 陈亮 人物二 白雪 联手 杀死 黑 风,NaN
 信任 人物二 济公 胭脂 陈亮 人物一,NaN
 信任 人物二 济公 陈亮 人物一,NaN
 第三部 时 陈亮 人物一 救出 肉身 人物二 五行 珠 打散,NaN
 白雪 重新 回到 济公 门下 回到 人物二 人物一 陈亮 身边,NaN
 程本 四十回 写 人物二 出家 王夫人 薛姨妈 安排 不得不 嫁给 人物一,NaN
 后来 做东 请 人物二 薛蟠 唱 小旦 人物一 锦 香院 妓女 云儿 饮酒 唱曲 晚方散,NaN
 袭人 人物一 一起 供奉 照料 他俩 人物二 萌生 出家 念头,NaN
 人物二 以玉 玦 扇坠 袭 松花 汗巾 相赠 人物一 回赠 北静王 所赐茜 香国女 国王 贡奉 大红 汗巾,NaN
 续 书写 人物二 出家 不得已 嫁给 人物一,NaN
 回 人物二 贾政 责打 忠顺 王爷 争宠 人物一 引起,NaN
 人物一 送 人物二 红 汗巾 子时 说 茜 香国 女王 进贡 汗巾 子,NaN
 人物二 同性 知己 秦钟 人物一 柳湘莲 附 北静王,NaN
 第三十三回 人物二 贾政 责打 忠顺 王爷 争宠 人物一 引起,NaN
 人物二 以玉 玦 扇坠 袭 松花 汉巾 相赠 人物一 回赠 北静王 所赐茜 香国女 国王 贡奉 大红 汉巾,NaN
 安 建文 想法 却是 悲剧 玩人终 玩 糗 相 林逸 录 下来 人物二 人物一 当成 笑料,NaN
 东海 市 调戏 人物二 人物一 林逸 阻止 林逸 结仇,NaN
