sent,hard_match
 人物二 唐韵 雨 凝 人物一 冯笑笑 王心 妍 天婵 关馨 土 冉冉 小九 冰糖 郁 小可 宋 凌珊,NaN
 人物一 角色 经历 人物二 闺蜜 两人 一起 长大,NaN
 一直 追求 人物二 成功 常常 人物一 戏耍 受尽 苦头 做些 费力 讨好 事情,NaN
 曾派 金钟 门 弟子 马柱 绑架 人物二 人物一,NaN
 钟品亮 松山 四大 恶少 追求 人物二 未 成 常 人物一 戏耍 受尽 苦头 做些 费力 讨好 事情,NaN
 一直 追求 人物二 成功 常常 人物一 戏耍 受尽 苦头 做些 费力 讨好 事情,NaN
 人物二 离开 人物一 便 整天 闷闷不乐,NaN
 林逸 走火入魔 陷入 昏迷 时 人物二 人物一 尽心尽力 保护 林逸 努力 挣钱 帮 买药,NaN
 人物二 人物一 游乐园 玩 楚鹏展 对手 再次 下手 给力 小舒 总能 歪打正着 坏人 一个个 惩罚,NaN
 先后 重用 人物二 薛居正 人物一 吕余庆 卢多逊 人为 宰执 禁止 将帅 干预 朝政,NaN
 人物一 赵匡胤 霸府 幕僚 中继 人物二 之后 第二个 升任 宰相,NaN
 纣王 纳其言 遂 诏 西伯 侯 人物二 北伯 侯崇 侯虎 两镇 合兵 以征 人物一,NaN
 人物二 一封信 人物一 服软 马上 进贡 闺女 投降 招安 早 干嘛,NaN
 使者 至岐州 人物二 接旨 管待 王使 谓 群下 曰 人物一 忤旨 失贡 天子 诏 合兵征,NaN
 遂 赦 人物一 官复原职 遣使 赍 金帛 赏分 人物二,NaN
 人物二 自作主张 和平 为主 干嘛 想想 人物一 曾经 朝歌 题过 反诗,NaN
 纣 王大怒 南伯 侯崇 侯虎 西伯 侯 人物二 合击 人物一 灭 九族,NaN
 第八 十六章 人物二 伐 人物一 成汤入 危局,NaN
 人物二 常 感叹 人物一 知己,NaN
 人物一 人物二 说 天下 乱 具有 改变 世道 能力 不能 挽救 局势,NaN
 仙剑 外传 内容 人物一 后来 成为 景天 徒弟 人物二 交好,NaN
 人物一 渝州 人物二 李兄,NaN
 历代 习得者 李寒 空 精精 景天 人物一 人物二 李逍遥 小蛮 瑕,NaN
 人物一 取悦 师父 四处 盗宝 唐家堡 遇 人物二 结为 好友 传 飞龙 探云手,NaN
 人物一 南盗 侠 李逍遥 父亲 景天 徒弟 李澜 长子 人物二 好友,NaN
 唐家堡 人物二 人物一 结拜 兄弟 蜀山 司徒 钟 酒剑仙 好友 经常 帮 司徒 钟带 酒 得以 习得 特技,NaN
 此技为 仙剑 系列 里 经典 招式 历代 习得者 李寒 空 精精 景天 人物一 人物二 李逍遥 小蛮 瑕 越 今朝,NaN
 人物一 外甥 人物二 前男友 曾小贤 张伟 损友,NaN
 人物一 外甥 人物二 前男友 曾小贤 张伟 损友,NaN
 爱情 公寓 番外篇 三 开心 原力 上线 吕子乔 张伟 人物二 人物一 四 人为 帮助 四位 外星 四个 角色 展开 穿越 之旅,NaN
 朋友 人物一 关谷神奇 秦羽墨 人物二 吕子乔 张伟 林宛瑜 弟弟 陆展博 恋人,NaN
 唐 人物二 歌者 人物一 诗 近来 时世轻 先辈 好染 髭须 事后 生,NaN
 人物二 诗句 唱得 凉州 意外 声 故人 惟有 人物一,NaN
 人物一 系统地 介绍 音乐 理论知识 人物二 唱 西域 西凉 甘肃 歌曲 受 启发,NaN
 长安 时 人物一 著名 思想家 诗人 人物二 有厚交 两人常 一起 交流 艺术 谈论 时世 可谓 志同道合,NaN
 人物二 人物一 帮助 吸收 融汇 民歌 音乐 素材 创造 一种 独特 诗体 竹枝词 风格 清新 当时 风靡 全国,NaN
 唐 人物二 歌者 人物一 诗 近来 时世轻 先辈 好染 髭须 事后 生,NaN
 歌者 人物一 唐代 文学家 人物二 创作 一首 短诗,NaN
 闯祸 不会 小姐 田思思 一直 仰慕 英雄 人物一 许配给 貌不惊人 人物二,NaN
 人物一 人物二 共同 走上 拯救 武林 正义 路 思思 楚楚 怀揣 真情 演绎 一段 爱恋 之歌,NaN
 人物一 人物二 共同 走上 拯救 武林 正义 路 思思 楚楚 怀揣 真情 演绎 一段 爱恋 之歌,NaN
 蔡东藩 高宗 内禅 孝宗 嗣位 当时 英明 称 相如 人物一 有帅 人物二 宜若 可锐 图 恢复,NaN
 赵昚 太子 时期 主张 抗金 即位 主战派 人物一 胡铨 人物二 虞允文 主战派 支持 积极 备战 兴师 北伐,NaN
 ④ 高宗 内禅 孝宗 嗣位 当时 英明 称 相如 人物一 有帅 人物二 宜若 可锐 图 恢复,NaN
 人物二 王十朋 胡铨 虞允文 陈俊卿 王大宝 主张 立即 北伐 史浩 人物一 主守,NaN
 ② 高宗 内禅 孝宗 嗣位 当时 英明 称 相如 人物一 有帅 人物二 宜若 可锐 图 恢复,NaN
 ★ 人物一 深深 吸 一口气 踏前 一步 双手 用力 握住 人物二 肩头 使劲 摇 摇 一字一句 道 没错 希望 以前,NaN
 媒体 见面会 现场 导演 人物二 携 主创 班底 亮相 始终 三缄其口 称 女一号 刘乐妍 戏份 很足 编剧 人物一 联合 导演 杨潇洒 一起 亮相,NaN
 五人 眼观四路 耳听八方 一步步 向内走 穿过 两重 院子 殿 突然 之间 人物二 人物一 停步 打个 手势,NaN
 人物二 声 伊藤加奈惠 人物一 声 户松遥,NaN
 剧情简介 人物二 已经 习惯 祖母 经营 温泉 旅馆 喜翠庄 生活 时 竞争 旅馆 独生女 人物一 来到 喜翠庄 进行 修行,NaN
 人物一 俗称 大刀 王五 河北 著名 回族 武术家 蜚声 武坛 戊戌 七 君子 人物二 过从甚密 侠肝义胆 谭所 称颂,NaN
 人物一 好友 求子 心切 人物二 帮 老婆 杨琳 完成 歌星 梦 配合 经纪 公司 炒作 没想到 真的 炒火 杨琳 事业 自此 一蹶不振,NaN
 最终 孩子 找到 价值 人物二 人物一 两个 男人 那位 适合 老婆 行走 幸福 婚姻 路上,NaN
 人物一 人物二,NaN
 靖 王为 皇七子 人物一 一代 贤王 皇 长子 祁王 萧景禹 身边 教养 长大 前 赤焰 军 少帅 人物二 最好 朋友,NaN
 人物二 对靖王 人物一,NaN
 皇子 人物一 人物二 最好 朋友,NaN
 第五十六章 人物二 义气 救窦昭 人物一 忠勇 助 太子,NaN
 第十九章 田氏 问罪 反 受辱 人物一 宽解 人物二 心,NaN
 媒体 见面会 现场 导演 人物一 携 主创 班底 亮相 始终 三缄其口 称 女一号 刘乐妍 戏份 很足 编剧 人物二 联合 导演 杨潇洒 一起 亮相,NaN
 泷岛 彗 人物二 山本 纯 山本芽 狩野 宙 人物一 辻龙,NaN
 当时 吕祖谦 正在 严陵 建德 任职 丽泽堂 执教 人物二 门人 潘叔度 潘叔昌 人物一 吕祖泰 金华 一批 学者 担任,NaN
 人物一 角色 介绍 人物二 一同 入宫 姐妹 傅昭 仪 陷害 死,NaN
 人物二 告诉 人物一 廷尉 府 一直 监视 扶苏,NaN
 郑微 后来 人物一 朋友 开办 公司 郑微 婚礼 出现 人物二 被迫 相亲 见 医生 纪廷 表露 不够 明显,NaN
 ★ 人物二 深深 吸 一口气 踏前 一步 双手 用力 握住 人物一 肩头 使劲 摇 摇 一字一句 道 没错 希望 以前,NaN
 元曲 前期 重要 作家 极善 修改 作品 录鬼 簿 称 人物二 莫逆 交 凡有 文辞 公 号 人物一,NaN
 人物一 门下 林平之 人物二 爱慕 林平之 掌握 辟邪 剑谱 自宫,NaN
 令狐冲 人物二 关系 却成 人物一 实现 第二步 战略 障碍,NaN
 从华山 下来 令狐冲 世界 里 不再 人物一 人物二,NaN
 林平之 福建省 福州市 人士 福威 镖局 第三代 传人 及少 总镖头 辟邪 剑法 合法 传人 人物一 之女 人物二 丈夫,NaN
 令狐冲 霍建华 饰 华山派 掌门 人物一 抚养 授武 华山派 弟子 钟情 青梅竹马 师妹 人物二,NaN
 华山 掌门 人物一 抚养 授武 华山 弟子 钟情 青梅竹马 师妹 人物二,NaN
 瞒过 人物一 耳目 佯装不知 真相 人物二 结下 有名无实 婚姻,NaN
 一位 知情 人士 爆料 称 人物二 报名 人物一 上海 朋友 介绍,NaN
 宝树 谈起 宝刀 来历 由宝树 金面佛 大侠 人物一 之女 人物二 平阿四 陶百岁 之口 讲述 与此相关 一段 武林 往事,NaN
 人物一 人物二 救起 得苗人 风为 打通 血脉,NaN
 人物一 带 幼女 人物二 一路 追至 商家堡 田归农 福康安 救,NaN
 人物一 看到 胡斐 卧 人物二 误会 胡斐行 不轨 大怒 之下 找 胡斐 算账,NaN
 地图 难度 根 道长 洪安通 人物二 人物一 一个 一个 难缠,NaN
 人物一 误会 胡斐 之后 火气 特别 是因为 一段 不堪回首 伤心事 人物二 事 特别 敏感,NaN
 人物一 家 人物二 闺房 水盆 有金 种子,NaN
 电视 香港 佳视 卫子云 饰 胡一刀 胡斐 白彪 饰 人物一 米雪 饰 袁紫衣 李通明 饰 人物二,NaN
 心理学 细致 分析 不要 说 胡斐 人物二 卧 尴尬 场面 两人 正常 爱恋 人物一 立时 接受,NaN
 电视 香港 无线 吕良伟 饰 胡一刀 胡斐 谢贤 饰 人物一 周秀兰 饰 袁紫衣 曾华倩 饰 人物二,NaN
 人物二 身世 秘密 彩 八仙 红仙 秀丽 之母 彩云 国缥家 白子 之躯 人物一 结合 生下 秀丽,NaN
 人物一 人物二 蔷薇 姬,NaN
 齐昊 人物一 之女 人物二 青梅竹马 两小无猜,NaN
 人物二 齐昊 人物一 之女,NaN
 师 侄女 人物二 齐昊 人物一 之女,NaN
 人物一 前朝 宫廷 文学 侍从 人物二 父,NaN
 人物二 人物一 之女 长孙均量 之徒 成为 武则天 记室,NaN
 婉儿 诞生 之际 祖父 上官仪 其父 人物一 皆 起草 废后 诏 人物二 书 武则天 处死,NaN
 电视 小说 宝莲灯 前传 作品简介 玉皇大帝 妹妹 瑶姬 不顾 天规 人物一 育下 杨蛟 杨戬 人物二 共享 天伦,NaN
 玉帝 得知 派 天兵天将 下界 杀 人物一 杨蛟 将瑶 姬压 桃山 之下 杨戬 人物二 哪吒 天 蓬元帅 帮助 侥幸 逃脱,NaN
 金乌 奉命 下令 诛杀 杨家 满门 杀 人物一 杨蛟 杨戬 人物二 天 蓬元帅 相助 之下 幸免于难,NaN
 该剧 讲述 玉皇大帝 妹妹 瑶姬 不顾 天规 人物一 育下 杨蛟 杨戬 人物二 共享 天伦,NaN
 天兵天将 下界 杀 人物一 杨蛟 将瑶 姬压 桃山 之下 杨戬 人物二 侥幸 得以 逃脱,NaN
 电视剧 配音 倚天 屠龙记 人物一 人物二 同一 屋檐下 同一 屋檐下 柏木 小梅,NaN
 倚天 屠龙记 人物二 杨逍 人物一 之女 纯真 善良,NaN
 自古 男女授受不亲 人物一 珍重 人物二 付托 张无忌 是否 托付 终身 想法 不得而知,NaN
 后来 灭绝师太 找到 人物一 时 刚好 张无忌 到蝶谷 医仙 胡青牛 医治 时 认识 人物二,NaN
 人物二 杨逍 人物一 之女 纯真 善良,NaN
 梁少霞 电视剧 配音 梁少霞 倚天 屠龙记 人物一 人物二 梁少霞 同一 屋檐下 同一 屋檐下 柏木 小梅,NaN
 灭绝师太 杨逍 人物一 人物二 殷梨亭,NaN
 人物一 早有 婚约 武当七侠 殷梨亭 心存 愧疚 明白 人物二 殷梨亭 情意 时 豁达 应允 殷 杨二人 婚事,NaN
 尤其 演戏 一块 潘仪君 饰演 版 人物一 人物二 深入人心,NaN
 人物一 人物二 两 母女 受伤 来到 蝴蝶谷,NaN
 张翠山 之死 莫声谷 之死 光明 顶上 人物二 揭开 人物一 之死 真相 时,NaN
 人物一 自觉 愧对 殷梨亭 行为 感到 抱歉 人物二 旁观者 自然 殷梨亭 更 一种 特别 欠 意,NaN
 杨逍 一女 人物二 峨嵋 女侠 人物一 生,NaN
 人物一 刘梅 想尽 办法 试图 帮助 人物二 重新 树起 信心,NaN
 家有 儿女 讲述 人物一 夫妇 子女 刘星 夏雨 人物二 一系列 故事,NaN
 谓 称 梅梅 人物一 妈妈 妈 刘星 夏雨 人物二 刘梅 阿姨 通用,NaN
 人物一 剧本 角马 爱情 符合 制作方 要求 枪毙 后来 人物二 汇演 节目 改成 角马 故事 取得成功,NaN
 谓 称 叔叔 老夏 通用 人物一 刘梅 玛丽 爸爸 爸 老爸 人物二 刘星 夏雨 小哥 加 菲猫 爸爸 刘梅,NaN
 人物一 刘梅 得知 消息 内心 暗自 焦虑 希望 越大 失望 越 担心 人物二 承受 不了 失败 打击,NaN
 如果说 人物二 美 落 实 平常 见 得到 那种 美丽 人物一 美 便是 带 朦胧 仙气,NaN
 之前 传 人物一 经高人 指点 拟将 爱女 唤作 刘云 善 尘埃落定 天王 宝贝 名曰 ─ ─ 人物二,NaN
 人物二 主要 作品 人物一 爱女 没有 演艺 经历 作品,NaN
 水浒 英雄 谱 母夜叉 人物二 人物一,NaN
 女儿 人物二 人物一 表示 事业 顺其自然 精神 愉快 身体健康 感觉 快乐,NaN
 狼 辟谣 访问 澄清 人物二 之母 人物一 接受 郎咸平 访问 声称 炒股 致富 拥有 百万 身家,NaN
 人物一 女士 微博 宣传 人物二 工作 室外 希望 网友 包容 郭美玲 表示 会 虚心接受 网友 建议 批评,NaN
 方步 亭 何其沧 家 见到 梁经纶 告诉 人物二 已死 消息 人物一 方孟敖 共产党,NaN
 方步 亭 走 人物一 程小云 出 人物二 制造 方孟敖 何孝钰 单独 相处 机会,NaN
 眼看 学生 一批批 释放 一直 没有 人物二 消息 方步 亭 担心 情况有变 遂 人物一 找 木兰,NaN
 徐铁 英走 方步 亭 人物一 商议 方孟韦 人物二 送到 法国 留学,NaN
 方孟敖 离开 人物二 意欲 撮合 方孟敖 何孝钰 反 人物一 训斥,NaN
 人物二 不解 人物一 反对 梁经纶 一起 哭 何孝钰 打电话 找 梁经纶 两女 陷入 梁经纶 情感 纠葛,NaN
 方步 亭 人物一 商议 方孟韦 人物二 送到 法国 留学,NaN
 邓小平 夫人 人物二 人物一 幼女 浦 琼英 故乡 高原 明珠 火腿 乡 宣威市,NaN
 人物一 宣威 地方 民族 工业 发展 中国 革命 作出贡献 一代 伟人 邓小平 岳父 平夫人 人物二 故居,NaN
 浦 琼英 人物二 著名 民族 实业家 人物一 之女 邓小平 夫人,NaN
 陆渐 人物二 见 呆 人物一 神色 茫然,NaN
 不久前 人物二 喜 贵子 外公 人物一 非常高兴,NaN
 店里 事务 主要 人物一 前妻 打理 人物二 担任 董事长,NaN
 人物二 汪洋 刚 成家 攒钱 装修 资金 人物一 出,NaN
 人物二 人物一 安排 大连市 公安局 辞职 来到 本山 艺术 学院 工作,NaN
 人物二 本山 艺术 学院 工作人员 人物一 长女,NaN
 人物二 人物一 安排 大连市 公安局 辞职 调入 本山 艺术 学院 工作,NaN
 人物一 全唐文 卷 二十二 ○ 封 人物二 制,NaN
 公主 嫡母 未 递相论告 诏令 离婚 复以 人物一 之女 韦氏 人物二 以妻,NaN
 东光 人物二 人物一 女 韦氏,NaN
 以玄宗 甥女 陈氏 东华 公主 妻 邵固 人物一 中宗女 嫁 韦捷 之女 韦氏 人物二 妻 鲁苏,NaN
 从甥 陈氏 东华 公主 妻 邵固 人物一 之女 韦氏 人物二 妻 鲁苏,NaN
 人物二 个人经历 人物一 可爱 女儿 出生 新闻,NaN
 期间 况天佑 人物一 不破 岳 瑶池 马小虎 月 人物二 人物 情感 深入 表现,NaN
 出现 个体 人物二 人物一,NaN
 紫 马家 血 命运 之力 加上 僵尸 血 盘古 之力 变成 特殊 紫眼 僵尸 人物二 人物一 汤金 宝,NaN
 几经 波折 人物二 主动 承认 况天佑 人物一 未来 女儿,NaN
 紫 马家 血 加上 僵尸 毒 变成 特殊 紫眼 僵尸 人物二 人物一 汤金 宝,NaN
 人物一 人物二,NaN
 紫 马家 血 加上 僵尸 血 变成 特殊 紫眼 僵尸 人物二 人物一 汤金 宝,NaN
 笨手笨脚 常 事情 搞砸 努力 不懈 地朝 目标 前进 人物二 袁湘琴 人物一 况天佑 之女 人神 战后 消失,NaN
 人物二 作者简介 人物一 钱钟书 夫人 本名 杨 季康 著名 作家 评论家 翻译家 学者,NaN
 该书 人物一 人物二 继子 继女 师长 学生 同事 好友 合著,NaN
 北师大 外语系 教授 人物二 北京师范大学 英语系 教授 钱钟书 人物一 女儿,NaN
 钱媛 内容简介 该书 人物一 人物二 继子 继女 师长 学生 同事 好友 合著,NaN
 夫人 人物一 著名作家 育有 一女 人物二,NaN
 一生 北京师范大学 教书 未 成为 名人 女儿 人物二 人物一 痛惜 可造 之材 未能 成材 读书种子 只发 一点儿 芽芽,NaN
 尖兵 人物二 作者简介 人物一 钱钟书 夫人 本名 杨 季康 著名 作家 评论家 翻译家 学者,NaN
 人物二 作者简介 人物一 钱钟书 夫人 本名 杨 季康 著名 作家 评论家 翻译家 学者,NaN
 人物二 继承 其母 人物一 媚术 总让 感觉 妖女 仅仅 媚 女,NaN
 人物一 母女 斗法 施妙妙 尚未 接口 人物二 已笑 道 妈 说,NaN
 男主角 谷缜 兄妹 关系 人物一 人物二 生母 谷缜 继母 喜欢 谷缜 一位 具有 悲剧 色彩 人物,NaN
 女 人物二 人物一 生,NaN
 人物二 是否是 同一 不得而知 可能 人物一 一个 女儿,NaN
 人物二 母 人物一 秦穆公 夫人,NaN
 人物一 终 令狐冲 人物二 救出 旋即 东方不败 展开 激斗 欲 重夺 魔教 掌门 一位,NaN
 黑木崖 人物一 右使 向问天 令狐冲 圣姑 人物二 共战 东方不败 此役 里 上官云 右眼 东方不败 绣花针 刺 瞎,NaN
 风 太师 叔 面子 令狐冲 情人 人物二 江湖 关系 人物一,NaN
 黑木崖 向问天 带你去 见 人物二 人物一 定计 杀上 黑木崖,NaN
 想想 令狐冲 人物一 向问天 人物二 冲上 黑木崖 杀 东方不败 发现 东方不败 揣着 包包 时,NaN
 武功 本属 天下第一 男主角 令狐冲 人物一 向问天 高手 围攻 尚能 落下风 人物二 一旁 折磨 爱人 杨莲亭 分神 杀,NaN
 出寺 人物二 相救 囚 于梅 庄 人物一,NaN
 性行 高洁 人物一 之女 人物二 接任 教主 情人 令狐冲 一道 化干戈为玉帛 卸职 完婚,NaN
 任家 阵容 人物二 令狐冲 人物一 东方不败,NaN
 人物一 获救 恒山 派 掌门 令狐冲 圣姑 人物二 天王老子 向问天 雕侠 上官云 一起 黑木崖 对付 东方不败 重夺 教主 之位,NaN
 出寺 正式 结交 人物二 两人 相救 幽禁 梅庄 人物一,NaN
 人民币 玩家 非 人民币 玩家 攻击 路线 走 桃谷六仙 令狐冲 人物二 人物一 岳不群 相互 点灯,NaN
 战胜 东方不败 藤原 信之介 晴子 再度 相聚 此刻 人物一 率领 令狐冲 人物二 向问天 趁机 杀上 黑木崖,NaN
 没有 败 人物一 令狐冲 人物二 东方不败 击败,NaN
 人物一 人物二 带 令狐冲 离开,NaN
 人物一 日月神教 教主 人物二 父 东方不败 刺 瞎 右眼 内力 反噬 死,NaN
 成员 风清扬 东方不败 人物二 人物一 令狐冲,NaN
 人物一 没有 冲虚道长 交 过手 此事 令狐冲 营救 人物二 时 高手 少林寺 谈话 时 得知 当时 冲虚道长 说 噢,NaN
 令孤冲 人物二 向问天 人物一 一同 找 东方不败 报仇,NaN
 阵容 弟子 东方不败 风清扬 令狐冲 人物二 人物一 岳不群,NaN
 其后 人物一 剿灭 五岳 剑 派 一役 中 旧疾复发 病故 女 人物二 暂任 教主,NaN
 囚禁 人物一 终 令狐冲 人物二 救出,NaN
 攻击 阵营 选择 笑傲 路线 独孤 风清扬 令狐冲 人物二 岳不群 人物一 左冷禅 向问天 相互 点灯,NaN
 人物一 日月神教 教主 人物二 父,NaN
 刘宋时 鄱阳 公主 改称 永 成君 生子 人物一 孙女 人物二 宋孝武帝 文穆皇后,NaN
 最后 徐子陵 人物二 结合 堪称 完美 人物一 心事 最后 邪 王 落地 成佛,NaN
 人物一 深情 忏悔 想像 至情至性 人物二 蕙质兰心 想像 风华绝代,NaN
 人物一 人物二 油画 作品 内容 介绍 写 画前,NaN
 观 人物一 人物二 父女 创作,NaN
 人物一 人物二,NaN
 人物二 人物一 李湘 女儿,NaN
 四 歌曲 爸爸 演唱 田亮 田雨 橙 人物一 人物二 张亮 张悦轩 林志颖 小小 志 郭涛 郭子睿,NaN
 爸爸 假期 剧组 主创 人物一 郭涛 张亮 领着 宝贝 人物二 石头 张悦轩 出场 参演 成东日 成俊 父子 成为 东道主,NaN
 爸爸 假期 影片 评价 人物一 人物二 星爸 萌娃 主演 爸爸 假期 获得 最高 认知率 圣诞版 海报 张,NaN
 林志颖 小小 志 郭涛 郭子睿 田亮 田雨 橙 人物一 人物二 张亮 张悦轩 李锐 何炅,NaN
 林志颖 郭涛 郭子睿 田亮 田雨 橙 人物一 人物二 张亮 张悦轩,NaN
 私生女 木婉清 秦红棉 生 人物二 人物一 生 阿朱 阿紫 阮星竹 生 王语嫣 李青萝 生,NaN
 私生女 木婉清 秦红棉 生 人物二 人物一 生 阿朱 阿紫 阮星竹 生 王语嫣 王夫人 生,NaN
 玶 常 伊尔根 觉 罗氏 子女 长女 人物二 人物一 出,NaN
 人物二 咸丰帝 唯一 女儿 母 人物一 他拉氏 即丽 贵妃,NaN
 皇三女 人物二 其母 人物一 刘佳 氏 时为 藩 邸 福晋,NaN
 人物二 嘉庆帝 第三 女 母嘉 亲王 侧妃 人物一 刘佳 氏 葬于 北京 公主坟 东侧,NaN
 皇三女 人物二 母 人物一 刘佳 氏 时为 藩 邸 福晋,NaN
 次 狼 红音也 人物一 名护 启介 蜘蛛 人物二 襟立健 吾 假面 骑士 假面 骑士,NaN
 人物一 金银 小剑 三 娘子 人物二 母亲 小说 刚 开头 时即 丧命,NaN
 人物二 香港 演员 人物一 前妻 邓拱璧 女儿 现为 剧场 全职 演员,NaN
 人物二 人物一 前妻 邓拱璧 女儿 现为 剧场 全职 演员,NaN
 父 人物一 中共 早期 著名 理论家 姐姐 人物二 姐夫 冼星海 均 爱国 民主运动 积极 参加者,NaN
 人物二 哥哥 长兄 钱远铎 次兄 钱远镜 人物一 遗留 革命 骨血,NaN
 冼星海 追问 人物二 泣不成声 告诉 人物一 亲生 父亲,NaN
 人物一 联合国 高级 职员 人物二 学习 费用 概由 联合国 部门 支付,NaN
 干部 司 人物一 认识 辽宁 姑娘 薛润 吾 人物二 母亲,NaN
 陆维钊 胡乾文 翁婿 驻 越南 前任 现任 大使 外 人物一 人物二 父女,NaN
 基本 信息 人物一 父 李崇 妻 乐平公主 杨丽华 女 宇文娥英 女 人物二,NaN
 汉王 杨谅 杨丽华 女儿 宇文娥英 嫁柱国 人物一 杨丽华 外孙女 人物二 杨丽华 继子 静帝 宇文阐,NaN
 人物二 母郑 人物一,NaN
 人物一 人物二,NaN
 回 父女 兵 上阵 人物一 人物二 不幸 答错 问题 接受 特训 二人 会否 再接再厉 挑战 特训,NaN
 第一 回合 问答题 父女 兵 上阵 人物一 人物二 不幸 答错 接受 特训,NaN
 女儿 无为而治 人物一 人物二,NaN
 人物一 千金 人物二 继承 父母 才貌 获得 校花 美誉 大学毕业 後 加入 城市 电讯 参与 艺员 进修班 提升 演技 表演 技巧,NaN
 人物二 香港 演员 香港 著名演员 人物一 梁洁华 爱女,NaN
 人物一 人物二 父女 签约 王维基 共同 参演 新剧,NaN
 记者 赞 人物二 样貌 出众 条件 进军 娱乐圈 时 人物一 排斥 应该 先 书 读完,NaN
 人物一 称 人物二 演戏 天分 肯学 够 放 怯场 比较 机灵 做到 导演 好多 要求 新人 表现 可说是 绰绰有余 见得,NaN
 城市 电讯 今天 举行 签约 仪式 宣布 邀得 重量级 演员 人物一 千金 人物二 参演 城市 电讯 於 八月 开拍 新剧,NaN
 十分 感激 人物一 信任 愿意 掌上明珠 人物二 踏出 演艺事业 第一步,NaN
 几经 波折 人物二 主动 承认 人物一 马小玲 未来 女儿,NaN
 期间 人物一 马小玲 不破 岳 瑶池 马小虎 月 人物二 人物 情感 深入 表现,NaN
 马小玲 阻止 人物一 参加 人神 之战 导致 地球 毁灭 人类 灭绝 人物二 一直 恨 马小玲,NaN
 笨手笨脚 常 事情 搞砸 努力 不懈 地朝 目标 前进 人物二 袁湘琴 马小玲 人物一 之女 人神 战后 消失,NaN
 僵尸 有个 约会 一代 僵尸 一个 马小玲 亲生女儿 人物二 未来 来到 现代 找 人物一 马小玲,NaN
 人物二 太 犀利 人物一 吐槽 驾驭 不了,NaN
 爱心 过剩 人物二 人物一 提出 进一步 照顾 猪们 要求 洗澡,NaN
 人物二 老爸 人物一 经商 头脑 郑东汉 杨受成 私交,NaN
 人物一 女 巨蟹座 人物二 母亲,NaN
 丁春秋 人物一 曾带 人物二 苏州 生活 琅 缳 福地 藏书 搬 苏州 这才 造就 王语嫣 武学 知识,NaN
 人物一 人物二 父 宁天 绝世 唐门,NaN
 七 宝琉璃 宗 宗主 人物一 独女 人物二 相爱 相恋,NaN
 朋友 戴沐白 奥斯卡 马红俊 人物二 朱竹清 独孤 博 人物一 古榕 尘心 波塞 西 小白,NaN
 九 宝琉璃 九彩 神女 人物二 人物一 古榕 尘心 波塞 西 白沉香 小白,NaN
 人物二 半岁 交给 姥姥 带 人物一 王宁 一两天 看看,NaN
 祭赛国 师徒 扫塔辨奇 冤枉 二郎神 梅山 七圣 相助 孙悟空 荡平 碧波 潭 打死 人物一 人物二 击伤 九头 虫,NaN
 人物二 改为 陆展元 人物一 之女 程英 表姊妹,NaN
 所使 武功 沙场 点兵 芙蓉 惊涛 掌 使用 招数 惊涛骇浪 注 人物一 排山倒海 人物二 大浪淘沙,NaN
 永久 使用者 人物一 练 成 两层 郭蔷薇 堂妹 郭巨侠 练 成 九层 圆满 莫小贝 郭教 吕青橙 练 成 七层 人物二,NaN
 电视剧 已知 招式 排山倒海 人物一 惊涛骇浪 郭蔷薇 吕青橙 大浪淘沙 人物二,NaN
 人物一 职业 学术 士 人物二 母亲,NaN
 人物二 不善 交际 后宫 逐渐 孤立 其母 人物一 柳奭 进入 后宫 时 同样 受 礼遇,NaN
 配角 君玮 小黄 人物二 慕仪 百里 瑨 秦紫烟 宋凝 沈岸 莺 哥 容垣 容浔 卿 酒 酒 公仪斐 慕容安 人物一,NaN
 人物二 踢 爆是 杯子 绕 地球 多圈 家 千金小姐 亲爹 人物一 香 飘飘 公司 董事长 兼 总经理,NaN
 人物二 打理 黄金 集团 人物一 创办 旗下 博彩 业务 澳门 博彩 分拆 何李 两家 交情 之深 可见一斑,NaN
 皇九女 人物二 母 人物一 乌雅氏 封为 寿 庄和硕 公主 指配 德徽,NaN
 人物一 人物二 继母 吴彩云 生母,NaN
 儿子 人物二 表妹 碧莲 结为 夫妻 素贞 小青 法海 人物一 四人 因果 已解 功德圆满 归天 界,NaN
 人物一 派出 蛊 兽 无意 中令 人物二 身亡,NaN
 羽裳 怀 小宝宝 希望 小宝宝 生下 人物二 回到 青木 居 也许 人物一 小宝宝 份 会 原谅 二人 幸福 生活,NaN
