sent,hard_match
 作品 中 位 主人公 人物一 人物二 舒克 贝塔 大灰狼 罗克,0
 今天 中国 大陆 岁 很少 知道 笔下 人物一 人物二 舒克和贝塔,0
 创作 人物一 人物二 舒克 贝塔 罗克 童话 艺术形象 少年儿童 中有 高 知名度,0
 人物一 人物二 一起 长 大门,0
 笔下 人物一 人物二 罗克 舒克和贝塔 影响 中国 两代 孩子,0
 简介 人物一 人物二 中国 童话 大王 郑渊洁 笔下 一对 双胞胎 兄妹 中国 孩子 中是 几乎 无人不晓 传奇人物,0
 人物一 全传 作品 人物 介绍 人物一 人物二 罗克 舒克和贝塔,0
 郑渊洁 被誉为 童话 大王 创作 童话 人物 人物一 人物二 舒克 贝塔 罗克 成为 亿万 小朋友 心中 明星 影响 几代人 成长,0
 人物一 人物二 带 罐头 小人 一起 上学 经历 忍俊不禁,0
 说 年代 出生 郑渊洁 有着 别样 感情 人物一 人物二 童话 形象 曾经 滋养 幼时 心灵,0
 人物一 总动员 人物二 系列 人物二 龙珠 风波 内容简介 人物一 郑渊洁 童话 中 最酷 男一号,0
 人物一 人物二 一点 知道 人物一 更 笑话 妹妹,0
 郑渊洁 中国 童话 大王 创作 人物一 人物二 家喻户晓 童话 形象,0
 扇门 里 有着 惊险 故事 人物一 人物二 一起 四扇 门里 探险,0
 人物一 带 人物二 魔方 里面 寻找 人物二 笑容 魔方 里面 充满 未知 变幻,0
 医生 人物一 爸爸 妈妈 商量 一下 人物一 胆 人物二 一点,0
 人物一 人物二 全传 作者 介绍 年 郑渊洁 出生 河北省 石家庄市 其父 原籍 山西 临汾 其母 原籍 浙江 绍兴,0
 人物二 刚 走 两步 时 人物一 点着 一个 小炮 扔 妹妹 脚旁,0
 年 文学创作 人物一 人物二 大灰狼 罗克 舒克和贝塔 笔下 文学 形象,0
 集 人物二 要求 参加 喜庆 婚宴 人物一 说出 有史以来 伟大 结婚 祝辞 新闻 垃圾 播放 时 千万别 生育,0
 人物二 人物 来源 结束 新年 迎来送往 之后 郑渊洁 决定 山西 家里 创造 一个 中国式 童话 人物 人物一,0
 罐头 小人 各有所长 人物一 人物二 带 罐头 小人 一起 上学 经历 忍俊不禁,0
 郑渊洁 童话 人物一 人物二 中 男主角 郑渊洁 童话 中 最酷 男一号 现已 注册 成 商标,0
 上海 美术电影 厂 中央电视台 设计 动画片 老鼠 嫁女 金元国 历险记 人物一 人物二 人物造型,0
 笔下 人物一 人物二 罗克 舒克和贝塔 影响 中国 三代 孩子,0
 大侠 人物一 阴差阳错 人物二 笑容 弄 丢 盗走 笑容 竟然 手中 魔方,0
 郑渊洁 被誉为 童话 大王 创作 童话 人物 人物一 人物二 舒克和贝塔 成为 亿万 读者 心中 明生 影响 几代人 成长,0
 人物一 画报 每期 人物一 故事 人物二 故事 系列 连环画,0
 笔下 人物一 人物二 舒克 贝塔 罗克 中国 拥有 亿万 读者 成年人 吸引 童话 被誉为 适合 全家 所有人 阅读,0
 人物一 总动员 人物二 人物二 中国 童话 大王 郑渊洁 笔下 著名 人物 诞生 年 月 日 农历 新年 正月初 六,0
 人物一 人物二 新 奇遇记 写给 爸爸妈妈 童话 作者 介绍 郑渊洁 中国 文坛 传奇人物,0
 人物一 人物二 故事 年 月 日 学苑 出版社 出版 图书 作者 郑渊洁,0
 人物一 红桃 老 内容梗概 人物一 人物二 舒克 贝塔 打扑克 发现 少 一张 红桃,0
 这是 一个 璀璨夺目 奇思妙想 好像 人物一 人物二 重新 回到 回忆 中,0
 年 李馨巧 参演 电视剧 人物一 人物二 饰演 人物二,0
 中国 儿艺 音乐剧 人物一 人物二 罐头 小人 编曲,0
 人物一 红桃 老 图书 简介 人物一 人物二 舒克 贝塔 打扑克 发现 少 一张 红桃 老,0
 中国 儿艺 音乐剧 人物一 人物二 罐头 小人 作曲 作词,0
 人物一 人物二 故事 作者简介 年 郑渊洁 出生 河北省 石家庄市 其父 原籍 山西 临汾 其母 原籍 浙江 绍兴,0
 人物一 人物二 剧情简介 人物一 家 最近 发生 一系列 怪事 起因 是从 未来 世纪 剧照 张,0
 鲍尔 历险记 人物二 一次 活动 中 获得 一个 可爱 大熊猫 鲍尔 人物一 橘子汁 之后 竟然 活 过来,0
 作品 中 位 主人公 人物一 人物二 舒克 贝塔,0
 人物一 生日 纪念 人物一 人物二 岁 生日 庆典 张,0
 笔下 人物一 人物二 罗克 舒克和贝塔 影响 两代 中国 孩子,0
 主要 作品 舞台剧 人物一 人物二 之红 沙发 音乐 城 中央电视台 教育片 开学 第一课,0
 笔下 人物一 人物二 罗克 舒克 贝塔 影响 中国 三代 孩子,0
 中国 大陆 岁 以下 知道 人物一 人物二 舒克和贝塔 已经,0
 读者 消失 十年 之久 人物一 人物二 回到 中间,0
 罐头 小人 各有所长 人物一 人物二 带 罐头 小人 一起 上学 发生 一连串 忍俊不禁 故事,0
 人物一 传 简介 人物一 人物二 中国 童话 大王 郑渊洁 笔下 一对 双胞胎 兄妹 中国 孩子 中是 几乎 无人不晓 传奇人物,0
 人物一 逃往 雅典娜 内容梗概 人物一 人物二 家里 发现 一个 暗室 暗室 里面 四扇 门 金门 银门 铜门 铁门,0
 人物 简介 人物一 人物二 中国 童话 大王 郑渊洁 笔下 一对 双胞胎 兄妹 中国 孩子 中是 几乎 无人不晓 传奇人物,0
 笔下 人物一 人物二 舒克 贝塔 罗克 中国 拥有 亿万 读者 成年人 吸引 童话 被誉为 适合 全家 所有人 阅读,0
 剧集 背景 中国儿童艺术剧院 联手 童话 大王 郑渊洁 最新 推出 童话剧 人物一 人物二 系列 作品 之二 魔方 大厦 改编,0
 集 人物二 看着 人物一 出神 班干部 长大 名气 人类 变小 老鼠 对手 人物二 承担重任,0
 年 月 日 主持 郑渊洁 人物一 人物二 三十岁 生日,0
 内容简介 人物一 人物二 双胞胎 兄妹 中国 孩子 中是 几乎 无人不晓 传奇人物,0
 人物一 人物二 之红 沙发 音乐 城 饰演 人物二,0
 月 日 朱新建 人物一 人物二 种 动画 人物造型 著名画家,0
 魔方 大厦 剧集 背景 中国儿童艺术剧院 联手 童话 大王 郑渊洁 最新 推出 童话剧 人物一 人物二 系列 作品 之二 魔方 大厦 改编,0
 人物一 人物二 故事 内容简介 人物一 人物二 双胞胎 兄妹 中国 孩子 中是 几乎 无人不晓 传奇人物,0
 年 月 日 月亮 姐姐 主持 郑渊洁 人物一 人物二 三十岁 生日,0
 正在 拍摄 人物一 人物二 饰演 人物一,0
 大侠 人物一 带 高兴 人物二 进入 魔方 世界 踏上 寻找 人物二 笑容 路,0
 笔下 人物一 人物二 舍克 贝塔 罗克 影响 中国 几代人 成长,0
 今天 中国 大陆 年轻人 很少 知道 郑渊洁 笔下 人物一 人物二 舒克和贝塔 作品 印数 逾 四千 万册,0
 人物一 人物二 全传 四川 少年儿童出版社 出版 书籍,0
 年 月 人物一 人物二 苏宇 导演 候克明 合作 演员 李馨巧,0
 人物一 诞生 之后 人物一 相对 人物二 随之 诞生,0
 人物二 故事 内容 介绍 人物一 人物二 双胞胎 兄妹 中国 孩子 中是 几乎 无人不晓 传奇人物,0
 人物一 人物二 新 奇遇记 写给 爸爸妈妈 童话 年 浙江 少年儿童出版社 出版 图书 作者 郑渊洁,0
 年 先后 拍摄 电视剧 蛋神 饰演 司想 人物一 人物二 饰演 人物一,0
 人物一 人物二 一对 双胞胎 兄妹 一天 人物二 帮助 妈妈 做饭 发现 藏 罐头 里 五个 小人,0
 人物一 人物二 双胞胎 兄妹 中国 孩子 中是 几乎 无人不晓 传奇人物,0
 创作 童话 人物 人物一 人物二 舒克 贝塔 罗克 成为 亿万 小朋友 心中 明星 影响 几代人 成长,0
 童话 作品 全新 独特 面貌 征服 全国 亿万 读者 笔下 人物一 人物二 舒克 贝塔 中国 孩子 中 无人不晓,0
 笔下 人物一 人物二 舒克 贝塔 罗克 中国 拥有 亿万 读者 童话 被誉为 适合 全家 所有人 阅读,0
 人物二 水晶 兔 人物一 总动员 • 人物二 系列 童话 大王 郑渊洁 新创 力作,0
 锁虫 锁住 人物二 笑容 人物一 想尽 一切办法 打不开 锁住 人物二 笑容 锁,0
 年 郑渊洁 儿子 郑亚旗 创办 人物一 漫画 杂志 人物一 人物二 卡通人物 形象 再次 风靡 全国,0
 人物一 人物二 系列 童话剧 人物一 人物二 系列 童话剧 罐头 小人,0
 释义 二赵 中国 西汉时期 著名 美女 人物一 人物二 合称,0
 公元前 年 人物一 人物二 出世 人物一 人物二 一对 双胞胎 姐妹花 出 生于 公元前 年,0
 野史 记载 人物一 人物二 姐妹俩 争 燕赤凤 最后 三个 一起 玩 双飞 推断 应该 没错,0
 飞燕 外传 其实 不能 称作 书 廖 廖 数千 字 性行为 中心 叙说 人物一 人物二 姊妹 汉成帝 之间 恩怨 纠葛,0
 姐妹花 惊人 性感 制胜 法宝 其艳名 远播 总让 联想 中国 历史 著名 美女 人物一 人物二 姐妹 大乔小乔,0
 昭阳 趣史 中 赵氏 姐妹 神话 色彩 人物一 前生 为青 邱山 燕子 精 人物二 前生 松果 山 九尾 野 狐狸精,0
 人物一 燕 啄 皇孙 汉书 里 记载 成帝 死后 司隶 解光 人物二 杀害 许美人 女官 曹宫 之子 奏疏 动机 想 惩罚 人物一,0
 永始 元年 前 年 汉成帝 立 人物一 皇后 晋 人物二 为昭仪 昭阳 殿 赐给 人物二 一人 居住,0
 成帝 晚年 沉溺 声色 人物一 人物二 姐妹 纵情 淫乐 政事,0
 二赵 中国 西汉时期 著名 美女 人物一 人物二 合称,0
 年 执导 古装 宫斗剧 汉宫 飞燕 该剧 描述 西汉时期 美女 人物一 妹妹 人物二 传奇一生 故事,0
 阳阿公主 曾经 府 中 教养 人物一 人物二,0
 人物一 父亲 冯 万金 做 江都 王府 里 舍人 江都王 孙女 姑苏 郡主 私通 生下 人物一 人物二 两个 孪生姐妹,0
 中国 古代 昏君 排行榜 汉成帝 宠幸 人物一 人物二 姐妹 最后 竟然 死 人物二 身上 赫赫有名,0
 后来 姐姐 人物一 无法 产下 皇子 人物二 人物一 解围 免遭 废,0
 远山 眉 基本 信息 汉 人物一 妹合德 薄眉 号 远山 黛 见伶玄 人物一 外传 人物二,0
 这年 十月 五日 燕赤凤 一次 应 人物二 之召 前去 效命 时 早已 妒火中烧 人物一 便 赶往 少 嫔馆 捉奸,0
 燕赤凤 汉书 中 人物一 人物二 两姐妹 汉书 有云 自鸿嘉后 稍 隆于 宠,0
 六月 封 人物一 皇后 封 人物二 为昭仪 大赦天下,0
 后来 人物一 人物二 姐妹 入宫 受宠 十分 嫉妒 班婕 汉成帝 心目 中 地位 便 设计 陷害 班婕,0
 说 麝香 放入 妓女 肚脐 避孕 堪称 中国 红颜 祸水 人物一 人物二 两 姊妹 记载 采取 避孕措施,0
 基本 信息 汉 人物一 妹合德 薄眉 号 远山 黛 见伶玄 人物一 外传 人物二,0
 二赵 释义 二赵 中国 西汉时期 著名 美女 人物一 人物二 合称,0
 燕赤凤 野史 人物一 做 皇后 成帝 宠爱 渐渐 衰减 妹妹 人物二 成帝 备加 宠爱 封为 昭仪 住 昭阳 宫中,0
 废 许皇后 立 人物一 人物一 之妹 人物二 立为 昭仪 两姐妹 专宠 后宫 显赫一时,0
 永始 元年 前 成帝 立 人物一 皇后 封 人物二 为仪 居 昭阳 宫 皆 黄金 白玉 明珠 翠羽 装饰,0
 该剧 描述 西汉时期 著名 美女 人物一 妹妹 人物二 传奇一生 故事 古装 电视剧 年 正式 发行,0
 后来 成帝 听说 人物一 妹妹 人物二 长得 更 美 合德 召人 宫中,0
 人物一 人物二 出世 人物一 人物二 一对 双胞胎 姐妹花 出 生于 公元前 年,0
 奸妃 中国 历代 奸妃 夏 妺 喜 商 妲 周 褒 姒 汉 人物二 人物一 三国 郭女王,0
 人物一 妹妹 人物二 许配给 妻 哪知 后来 害死 人物一 妹妹 华山派 掌门人 鲜于通,0
 人物一 救治 性命 人物一 之妹 人物二 相恋,0
 当年 人物一 救治 性命 人物一 之妹 人物二 相恋,0
 人物一 回 后宫 发现 女官 欺负 一对 双胞胎 回顾 当年 人物二 入宫 日子,0
 姐妹花 人物一 人物二 深陷 幸亏 太监 小马 子 暗中帮助 逃过 劫难,0
 人物一 心机 小马 子 远离 人物一 人物一 妹妹 坟墓 移入 皇宫 请 唐玄宗 封 人物二 为兰妃,0
 人物二 出场 章节 苏旷 传奇 人物二 第一卷 沽义 天下 东篱 把酒 黄昏 天下第一 杀手 人物一 吟诗 漫步 探著 南枝 开遍 未,0
 年 人物一 不同 场合 一直 支持 人物二,0
 不同于 单纯 经纪人 姐姐 工作 余 兼顾 人物二 身体 意见 产生分歧 人物一 会 尽力 说服 妹妹,0
 小说 平凡 世界 中 人物 人物二 女 年生 路遥 平凡 世界 中 人物 主人公 人物一 孙少平 妹妹,0
 详细 介绍 平凡 世界 中 人物二 孙家 最小 孩子 孙玉厚 女儿 人物一 孙少平 妹妹,0
 人物二 详细 介绍 平凡 世界 中 人物二 孙家 最小 孩子 孙玉厚 女儿 人物一 孙少平 妹妹,0
 赵敏 抓住 六大 派 峨嵋派 手中 夺得 倚天剑 人物一 小昭 赵敏 周芷若 人物二 一起 接 金毛狮 王 谢逊 回 中原,0
 年 苏有朋 贾静雯 高圆圆 共同 参演 古装 武侠剧 倚天 屠龙记 饰演 人物一 表妹 人物二,0
 人物二 人物一 爽爽快快 说好 怕,0
 万安 寺 中 临危受命 答应 灭绝师太 接任 掌门 荒岛 使计害 人物二 嫁祸 赵敏 拿走 屠龙刀 倚天剑 人物一 订立 婚约,0
 人物一 四女 之中 人物二 感情 亲切 自然 可敬 可感 或许 是因为 人物二 母亲 殷素素 相像,0
 年 邵氏 公司 尔冬升 饰 人物一 余安安 饰 周芷若 井莉 饰 赵敏 文雪儿 饰 人物二 顾冠忠 饰 宋青书,0
 人物二 人物一 表妹 少女 高强 人物一 一段 患难 真情 长大 误会 解除 高强 已经 娶妻 呆 人物一 身边,0
 小时候 蝴蝶谷 初遇 少年 人物一 欲 带 灵 蛇岛 作 玩伴 挣扎 咬伤 岂料 人物二 咬定 情 情根 深种,0
 人物一 蜀山 擒拿 人物二 长卿 赶到 见到 人物一 气焰嚣张 遂 鸣钟 召集 众 弟子 山门 集结 应敌,0
 从里 蜀山 进入 土属 阴性 地脉 后来 蜀山 故道 遇 人物一 率领 大军 攻山 人物二 透露 人物一 追 回去 和亲,0
 人物一 人物一 逼婚 人物二 好像 巡逻兵 过来,0
 从里 蜀山 进入 土属 阴性 地脉 后来 蜀山 故道 遭到 人物一 攻 率领 大军 攻山 人物二 告诉 哥哥 人物一 追 回去 和亲,0
 人物一 寻找 人物二 之事带 大军 强 闯 蜀山 欲 炮轰 锁 妖塔 重楼 挡 魔 血弹 瞬间 毁灭 人物一 军队,0
 人物一 人物一 逼 蜀山 人物二,0
 人物二 个人 生活 人物二 姐姐 台湾 女演员 人物一 姐夫 台湾 男演员 陈宇风,0
 月 日 徐淑媛 包翠英 人物一 人物二,0
 年 黄祖权 执导 古装 历史剧 人物一 中 饰演 人物二,0
 人物一 人物二 小说 中 薛仁贵 之子 女,0
 人物二 主要 剧情 说史 演义 人物一 征西 中 金莲 哥嫂 人物一 樊梨花 一同 征西,0
 李玉芝 饰 人物二 徐和 才饰 前部 人物一 李和曾 饰 后部 人物一,0
 年 人物一 传奇 饰 人物二,0
 程咬金 听 少女 人物二 羞涩 含蓄 回报 明白 窦仙童 看上 人物一 听 更为 羞涩 含蓄 汇报 明白 窦一虎 看上 人物二,0
 人物一 杨丽花 许秀年 饰 人物二,0
 人物一 樊梨花 饰 窦一虎 搭档 人物二 青蓉饰 杨丽花 饰 人物一 许秀年 饰 樊梨花,0
 苏军 大营 偷袭 薛仁贵 亲自 出手 人物一 妹妹 人物二 苏凤 儿子 交手 人物一 看到 父亲 受敌 只好 出手,0
 人物二 大哥 人物一 人物二 大哥 武三思 父亲,0
 人物二 母亲 便 两个 儿子 人物一 武元爽 领 出让 袁天罡 相面 袁天罡 一看 说 官至 三品 只不过 保家 主儿 不算 大贵,0
 贺兰敏之 裙带关系 人物二 父 武士彟 原本 娶 相 里氏 为妻 生 人物一 武元爽 兄弟,0
 唐朝 荆州 都督 武士彟 之孙 女皇 人物二 异 母兄 人物一 之子 武三思 人物二 侄子 初 封梁王,0
 金庸 小说 神雕侠侣 中 杨过 倾心 无法 接受 情意 二女 人物一 人物二 结拜,0
 遇到 柯镇恶 之后 一定 马上 嘉兴 人物一 人物二 住所 旁边 民房 里面 找段 老 中间 不要 做 段 老将 过世,0
 年 刘德华 版 杨过杨 来到 谷中后 见到 人物一 人物二 李莫愁 正在 动手 杨过 救 中情 花毒,0
 两口 相差 半载 年纪 人物一 秀雅 文静 人物二 却是 十分 活泼 两个 性格 截然不同,0
 杨过 来到 谷中后 见到 人物一 人物二 李莫愁 正在 动手 杨过 救 中情 花毒,0
 少年 发誓 决计 不会 姑姑 独守 十六年 寂寞 李莫愁 闲身 空恨 不会 人物一 人物二 苦熬 年华,0
 李莫愁 於 绝情谷 身中 情花 之毒 武氏兄弟 人物一 人物二 围攻 最终 葬身 於 火海 之中,0
 杨过 评价 人物一 极 美的 姑娘 人物二 评价 美人儿 郭 芙 美丽 武小武 两 兄弟 初见 人物一 墙头 男孩 摘 一朵花,0
 性情 内敛 武功 中 表妹 人物二 武功 低微 牙 尖嘴利 往往 自不量力 惹事生非 得罪人 人物一 收场,0
 武三娘 答话 黄影 闪动 窜入 庄中 搜寻 竟 人物一 人物二 人影,0
 人物一 人物二 心系 杨过 流露 情意 郭芙因 前事 人物二 怒气 郁积 久 忍不住 出言 讥嘲 黄蓉 喝止 作罢 郭 芙 众人 回 襄阳,0
 人物二 陪 杨过 小龙女 郭 芙 出言 讥讽 人物一 轻描淡写 全 挡回去 说 杨过 一起,0
 人物 陆立鼎 陆二娘 人物二 人物一,0
 人物二 得寸进尺 演完 第一个 打通 手机 哥哥 人物一 说 老妹 演得 进步 特别 语言 哥哥 觉得 满意,0
 月 日 人物一 生日 人物二 拎 一只 大大的 蛋糕 找 一帮 朋友 医院 里 哥哥 过生日,0
 一天 晚上 父母 演出 人物一 问 人物二 月儿 想 吃 炒面 ﹖ 人物二 根本 知道 炒面 点头 同意,0
 儿媳 尤氏 因办 丧事 家中 无人 照管 接 继母 妹妹 人物一 人物二 来家,0
 人物二 人物二 十二 副钗 尤氏 继母 带来 女儿 人物一 妹妹,0
 金陵 十二钗 副册 人物二 情刚 人物二 尤氏 继母 带来 女儿 人物一 妹妹,0
 电影 剧情 清朝 康熙 乾隆年间 宁国府 纨祷 子弟 贾珍 远房亲戚 人物一 人物二 母亲 来到 贾府 拜寿,0
 红楼 二 尤 人物二 红楼 二 尤 人物 介绍 人物二 红楼梦 中 人物 尤氏 继母 带来 女儿 人物一 妹妹,0
 也许 记得 小说 回 人物一 人物二 宁国府 情景 贾蓉 人物一 人物二 面前 丑态,0
 人物二 人物二 尤氏 继母 带来 女儿 人物一 妹妹,0
 作者 身上 花 笔墨 少之又少 集中 回至 回 人物一 人物二 悲剧 中,0
 红楼梦 中 尤老娘 人物一 人物二 之母 宁国府 当家 奶奶 尤氏 继母 一个 看似 极 不起眼 小人物,0
 金陵 十二 副钗 人物二 人物二 十二 副钗 尤氏 继母 带来 女儿 人物一 妹妹,0
 尤者 红楼梦 里 人物一 人物二 尤 孤独 地以 极端 女性 之姿 盛放 男权 社会 中 套 一句 时髦 应该 非常 女人,0
 尤老娘 简介 尤老娘 曹雪芹 小说 红楼梦 中 人物 人物一 人物二 娘,0
 贾珍 妻子 尤氏 见 无人 料理 宁府 事务 继母 两个 妹妹 人物一 人物二 接到 府 中,0
 人物二 人物 介绍 人物二 红楼梦 中 人物 尤氏 继母 带来 女儿 人物一 妹妹,0
 副册 中 人物二 到底 排 人物一 前面 后面,0
 人物二 人物一 懦弱 屈辱 糊涂 和善 相对 人物二 刚烈 自尊 清醒 泼辣,0
 年 演出 红楼 二 尤 前饰 人物二 后饰 人物一 保留 荀派 特色 唱腔 表演 中均 融进 理解 创造,0
 贾琏 娶 人物一 人物二 继续 陪 母亲 寄居 人物一 院子 里,0
 可惜 人物二 没有 机会 王熙凤 照面 死 人物一 失去 妹妹 魔窟 中 说 更加 孤立无援,0
 人物二 人物 名句 人物二 个性 泼辣 刚烈 不像 姐姐 人物一 般 任人摆布,0
 尤老娘 曹雪芹 小说 红楼梦 中 人物 人物一 人物二 娘,0
 红楼梦 中 二 尤 红楼 二 尤即 指 人物一 人物二 两个,0
 人物二 人物 介绍 人物二 红楼梦 中 人物 尤氏 继母 带来 女儿 人物一 妹妹,0
 妹妹 婚事 人物一 询问 人物二 后方 知 人物二 看中 柳湘莲,0
 克星 邢育森 七舅 姥爷 人物一 人物二 人物一 堂妹,0
 武林 外传 中 人物一 人物二 使用,0
 人物一 日本 动画 千与千寻 中 人物 汤屋 主管 人物二 双胞胎 姐姐,0
 千与千寻 演员 人物二 人物一,0
 人物一 角色 经历 人物一 人物二 法力 强大 女巫,0
 人物一 要千寻 交出 白龙 白龙奉 人物二 命令 偷取 人物一 魔女 合约 印章,0
 仙剑 五前 传 中 人物二 活泼 姐姐 人物一 蜀山 弟子 经常 师兄 铁笔 一起 外出 共事 经历 人物一 参与 盗鼎 事件 变为 冷淡,0
 人物一 心怀 苍生 妹妹 人物二 蜀山 最受 期待 弟子,0
 龙幽 临走前 告诉 人物二 蜀山 禁洞 中 遇到 人物一 鬼魂 惦记 妹妹,0
 人物一 人物二 铁笔 原 师侄 人物一 谢沧行 亡故 铁笔 人物二 因锁 妖塔 原因 成为 蜀山 七圣 辈分 变为 青石 师弟妹,0
 人物二 回到 蜀山 时 刚好 遇到 人物一 参与 盗鼎 事件 震惊 人物二 始终 沉默 之中,0
 摇光宫 闯过 人物二 第一阵 龙幽 人物一 龙溟 事情 告诉 人物二 告诉 人物二 道长 人物一 想念,0
 人物二 考虑 姐姐 人物一 刚 卷入 盗鼎 风波 中 适合 说 妖魔 事,0
 人物一 离开 人物二 不再 过去 开朗 活泼 变得 严肃 淡然 人物一 思念 封存 心底 没 提起过 人物一 事,0
 师侄 中有 人物一 人物二 希恒,0
 人物一 人物二 铁笔 原 师侄 人物一 谢沧行 亡故 铁笔 人物二 因锁 妖塔 原因 成为 蜀山 七圣 辈分 变为 玉书 师弟妹,0
 人物二 听从 人物一 下山 除妖 人物一 约定 二人 再见 时要 互相 聊 路途 新鲜事,0
 一对 小宝贝 出生 牛 年 正月初一 赵本山 取小 名叫 牛牛 妞妞 大名 人物一 人物二,0
 人物二 演唱 歌曲 至死不渝 人物一 填词 人物二 谱曲 演唱 歌曲,0
 人物一 人物二 哥哥 林嘉欣 黄耀明 一位 成员 卢凯彤 人物二 家人 朋友 书写 特别 文字,0
 人物二 拥有 靓丽 歌喉 性格 外向 人物二 哥哥 人物一 性格 截然 相反 默契 十足,0
 蓼 风轩 人物二 人物二 金陵 十二钗 人物一 妹妹,0
 人物二 古典名著 红楼梦 中 人物 金陵 十二钗 贾家 四姐妹 中 年纪 最小 一位 宁国府 中 人物一 胞妹,0
 红楼梦 中 人物二 人物二 金陵 十二钗 人物一 妹妹,0
 人物二 人物二 金陵 十二钗 人物一 妹妹,0
 金陵 十二钗 图册 判词 人物二 人物二 金陵 十二钗 人物一 妹妹,0
 儿童节目 剪花 花 人物一 人物二 中国舞蹈家协会 南方 舞蹈 学校,0
 表演者 人物一 已故 人物二 中国舞蹈家协会 南方 舞蹈 学校,0
 年 人物一 带来 同样 萌翻 全场 妹妹 人物二,0
 人物一 已故 人物二 中国舞蹈家协会 南方 舞蹈 学校,0
 人物一 人物 评价 人物一 左 人物二 春晚,0
 表演者 人物一 人物二 中国舞蹈家协会 南方 舞蹈 学校,0
 人物一 人物二 中国舞蹈家协会 南方 舞蹈 学校,0
 剪花 花 观众 反响 创意 儿童节目 剪花 花 节目 两个 身着 年 味十足 人物一 人物二 中式服装 可爱 小朋友 说 儿歌,0
 人物二 微博 缅怀 人物一 长微博 怀念 哥哥 年 月 日 人物二 发表 长微博 怀念 哥哥 怕 时间 久 会 哥哥 忘记,0
 龙年 春晚 开场 零点 报时 开门 娃娃 人物一 更是 携手 妹妹 人物二 再次 登上 年 蛇 年 春晚,0
 观众 反响 创意 儿童节目 剪花 花 节目 两个 身着 年 味十足 人物一 人物二 中式服装 可爱 小朋友 说 儿歌,0
 剪花 花 年 央视春晚 创意 儿童节目 河北 邯郸 普通 农家 兄妹 人物一 人物二 演员 表演,0
 建元 元年 年 三月 人物一 封为 皇后 人物二 封为 右 皇后,0
 建兴 三年 年 三月 汉 赵昭 武帝 刘聪 娶 靳准 两个 女儿 人物一 人物二 并立 人物一 皇后 人物二 右 皇后,0
 刘聪 娶 中护军 靳准 两个 女儿 人物一 人物二 人物一 立为 皇后 刘贵妃 立为 左 皇后 人物二 立为 右 皇后,0
 人物一 水浒传 中 人物 梁山 人物二 哥哥 扈家庄 庄主 之子 绰号 飞天 虎,0
 玩家 找到 人物二 得知 事情 真相 当日 人物二 兄长 人物一 投降 梁山 祝龙 发现 血洗 扈家庄,0
 执导 杨家将 水浒传 三国演义 诸多 作品 三国演义 中 扮演 司马师 水浒传 中 扮演 人物二 哥哥 人物一,0
 扈青 原型 人物二 哥哥 人物一 战争 年代 烈士 家乡 做 特警队 队长 只想 完成 父兄 遗愿 守护 家乡 嫉恶如仇,0
 人物一 简介 人物一 水浒传 林冲 活 于文龙 水浒 人物 谱 中 人物一 擒 人物二 人物一 便 想 投降 梁山,0
 玩家 找到 人物二 得知 事情 真相 当日 人物二 兄长 人物一 投降 梁山 祝龙 发现,0
 女 人物一 双胞胎 妹妹 人物二 团队 中国 女子 羽毛球队,0
 年 月 韩国 羽毛球 公开赛 女双 决赛 中 包宜鑫 搭档 汤金华 战胜 同胞 人物一 人物二 夺得 冠军,0
 第二局 人物二 人物一 展开 反击 两人 加强 攻势 开局 领先,0
 双打 决赛 女双 决赛 中国 年轻 组合 人物二 人物一 面对 中华 台北 名将 简玉瑾 程文欣 去年 加拿大 公开赛 人物二 人物一 输给 对手,0
